Website,Agency,Bureau,Office,Description
apps.bea.gov,Department of Commerce,BEA,,"Website that supports BEA's mission's to provide the most timely, relevant, and accurate economic accounts data in an objective and cost-effective manner."
bea.gov,Department of Commerce,BEA,,"Website that supports BEA's mission's to provide the most timely, relevant, and accurate economic accounts data in an objective and cost-effective manner."
acmt.bis.doc.gov,Department of Commerce,BIS,,This application allows the Office of the Chief Counsel to process Administrative Enforcement Induction Committee submissions. 
bis.gov,Department of Commerce,BIS,,This site provides information to the public on the United States Bureau of Industry and Security
cars.bis.gov,Department of Commerce,BIS,,"This application provides industry users to submit applications, declarations of conformity and advisory opinion requests related to the Connected Vehicles final rule. "
cwc.gov,Department of Commerce,BIS,,This site provides information on the US Chemical Weapons Convention to exporters and federal employees. It will be deprecated after information is migrated to bis.gov
cwcweb.cwc.gov,Department of Commerce,BIS,,This web application allows industry users to submit declarations/reports to comply with Chemical Weapons Convention regulations 
efoia.bis.doc.gov,Department of Commerce,BIS,,This site provides information to the public on how to complete a Freedom of Information Act request. 
slid.bis.doc.gov,Department of Commerce,BIS,,This site is used by external agencies to submit license determination requests to determine whether a license or permit is required for the import or export of specific goods. 
snapr.bis.gov,Department of Commerce,BIS,,"This application provides exporters the ability to submit and track notifications for export and reexport licenses, commodity classification requests and license exception agricultural commodities. "
tac.bis.doc.gov,Department of Commerce,BIS,,This site provides information to industry and federal employees about the Technical Advisory Committees that advise BIS. 
access.census.gov,Department of Commerce,Census,,
api.census.gov,Department of Commerce,Census,,
ask.census.gov,Department of Commerce,Census,,"This customer service site provides the public with a searchable knowledgebase of FAQs about the Bureau and our programs, as well as the primary contact form to submit direct questions to our agents. "
bds.explorer.ces.census.gov,Department of Commerce,Census,,"Access to Business Dynamics Statistics (BDS) dataset to compare, rank and visualize BDS data, NAICS industry, geography, and/or establishment and firm characteristics. "
bhs.econ.census.gov,Department of Commerce,Census,,BHS is designed to assist businesses and government agencies with their survey needs.
cbb.census.gov,Department of Commerce,Census,,"Census Business Builder (CBB) is a suite of services that provide demographic and economic data products, reports, and visualizations tailored to entrepreneurs in a simple to access and use format."
census.gov,Department of Commerce,Census,,"Census.gov is where business, government, researchers, and citizens find quality data about the US and world population and economy and information about our many surveys, censuses, and programs."
coil.census.gov,Department of Commerce,Census,,"The COIL website provides information to the public about projects, initiatives, and news from the COIL team."
data.census.gov,Department of Commerce,Census,,data.census.gov is the web-based application for the Census Bureau's data dissemination platform. 
geocoding.geo.census.gov,Department of Commerce,Census,,"The Census Geocoder is a web-based tool that allows the general public, local/state governments, federal agencies, and other industries to submit address(es) and find associated Census geographies. "
j2jexplorer.ces.census.gov,Department of Commerce,Census,,"Interactive visualizations allow for the construction of tables, charts, and maps to compare, aggregate, and analyze Job-to-Job earnings and Job-to-Job flows by worker and firm characteristics."
ledextract.ces.census.gov,Department of Commerce,Census,,Provides easy access to the raw data products produced through the Local Employment Dynamics (LED) Partnership by allowing users to query only the rows and columns of data they need.
lehd.ces.census.gov,Department of Commerce,Census,,"LEHD/LED Partnership: Hosts raw data downloads, interactive data tools, SOPs, educational materials, and research. These data are for state partners, public-policy, research, and businesses"
mtgis-portal.geo.census.gov,Department of Commerce,Census,,"Access and view Census public GIS applications in this Enterprise Sites Gallery. Designed to meet the needs of citizens, business, and government to easily find our parent applications."
opportunity.census.gov,Department of Commerce,Census,,The Opportunity Project website provides information to the public about The Opportunity Project and related activities.
portal.census.gov,Department of Commerce,Census,,Respondent Portal provides survey respondents a secure method to respond survey instruments and access self-service features in support of data collection
qwiexplorer.ces.census.gov,Department of Commerce,Census,,
respond.census.gov,Department of Commerce,Census,,"Internet Data Collection System (Centurion).  Public-facing hosting over 100 data collections (monthly, quarterly, and annually) enabling members of the public to securely submit responses online.   "
spd15revision.gov,Department of Commerce,Census,,"U.S. Office of Management and Budget's Statistical Policy Directive No. 15: Standards for Maintaining, Collecting, and Presenting Federal Data on Race and Ethnicity"
tigerweb.geo.census.gov,Department of Commerce,Census,,"TIGERweb provides web map services and applications from the Census Bureau's geographic database to geographic partners, local governments, federal agencies, and the general public."
usatrade.census.gov,Department of Commerce,Census,,"USA Trade Online (UTO) is a vital platform that ensures public access to timely, detailed data relevant to their specific interest in International Trade data."
www2.census.gov,Department of Commerce,Census,,"File transfer protocol (FTP) site for downloading of documents and digital assets available on census.gov, the U.S. Census Bureau's offical dissemination website."
xd.gov,Department of Commerce,Census,,"The xD website provides information to the public about projects, initiatives, and news from the xD team."
eda.gov,Department of Commerce,EDA,,"Providing information on grants, funding opportunities, strategic initiatives, and grantee resources for public stakeholders, and highlighting EDA’s impact across the country."
sfgrants.eda.gov,Department of Commerce,EDA,,"External stakeholder facing grants management portal. Provides visibility into EDA's funding opportunities, allows them to apply, engage with EDA staff and manage funded projects."
2014-2018.firstnet.gov,Department of Commerce,FirstNet,,Provides archived information to the public about the First Responder Network Authority's early efforts to establish a broadband network for public safety professionals
5x5.firstnet.gov,Department of Commerce,FirstNet,,"Highlights the Public Safety Innovation Summit, showcasing advancements in communication technology for first responders, researchers, industry, and government leaders"
firstnet.gov,Department of Commerce,FirstNet,,Offers resources on a nationwide broadband network for first responders to the general public and enhancing emergency communication for public safety professionals 
access.trade.gov,Department of Commerce,ITA,,This system is required for users to submit documents in AD/CVD proceedings and by the Courts in the form of a Court Record if administrative proceedings are litigated.
beta.trade.gov,Department of Commerce,ITA,,Critical search tool for the International Trade Community to find easy answers on upcoming AD/CVD deadlines and scope information on existing AD/CVD Orders.
dataprivacyframework.gov,Department of Commerce,ITA,,"Data Privacy Framework allows eligible U.S.-based organizations to self-certify compliance data privacy standards under EU-U.S. DPF, UK Extension to EU-U.S. DPF, and Swiss-U.S. DPF."
developer.trade.gov,Department of Commerce,ITA,,ITA's developer portal for providing open data to the public via API in JSON format.
enforcement.trade.gov,Department of Commerce,ITA,,Hosts legacy content related to AD/CVD work.
esel.trade.gov,Department of Commerce,ITA,,This is a statutorily mandated library of countervailing duty decisions made by ITA.
legacy.export.gov,Department of Commerce,ITA,,"Export.gov provided trusted market intelligence, practical advice and business tools to help U.S. companies expand in global markets."
legacy.trade.gov,Department of Commerce,ITA,,The relevant content that the site hosts includes two webpages on steel archival data.
ofis.trade.gov,Department of Commerce,ITA,,This is a portal for the importing public to submit applications to Foreign Trade Zones.
stopfakes.gov,Department of Commerce,ITA,,"STOPfakes, a 10-agency program, provides guidance to businesses for protecting their intellectual property rights. Its digital resources bolster its live roadshows and tradeshow appearances."
trade.gov,Department of Commerce,ITA,,"Provides business services and resources to ensure the U.S. competes globally, such as export tools and event registration, market research, trade barrier assistance, and inbound investment support."
wwtg.gov,Department of Commerce,ITA,,"The wwtg.gov site is an informational site for the World Wine Trade Group, an international government group to facilitate trade in wine and reduce barriers to trade."
mbda.gov,Department of Commerce,MBDA,,"Main site for bureau providing general information on business & financial resources, research and more."
abacus.nist.gov,Department of Commerce,NIST,,Web application that carries out experimental design and statistical analysis for chemical calibration studies. Intended audience is chemical scientists.
actev.nist.gov,Department of Commerce,NIST,,"evaluations to accelerate the development of robust, multi-camera, automatic activity detection algorithms for forensic and real-time alerting applications. performers in the evaluations"
acvts.nist.gov,Department of Commerce,NIST,,site to support the Automated Cryptographic Validation Program used to test algorithms implementations
adsorption.nist.gov,Department of Commerce,NIST,,"Provides access to databases and tools related to adsorption properties of gases and liquids on solid adsorbents. Used by Researchers, Academic Institutions, and public citizens."
ai-challenges.nist.gov,Department of Commerce,NIST,,Community evaluations to advance safe and trustworthy AI. Target Audience: Performers in the GenAI and Aria challeneges
airc.nist.gov,Department of Commerce,NIST,,Support and operationalize the NIST AI Risk Management Framework and accompanying playbook. Target Audience: General public/Industry interested in AI
ambench.nist.gov,Department of Commerce,NIST,,"Provides resources for the Additive Manufacturing Benchmark Test Series, a NIST initiative supporting the validation of computational models for aditive manufacturing.  "
ambench2022.nist.gov,Department of Commerce,NIST,,"Provides resources for the Additive Manufacturing Benchmark Test Series, a NIST initiative supporting the validation of computational models for aditive manufacturing."
ammd.nist.gov,Department of Commerce,NIST,,"….to nist.gov/programs-projects/data-management-and-fusion-am-industrialization.  This site is in indefinite maintenance mode. When online, the site provides a searchable database of materials used in additive manufacturing for the public and industry collaborators."
aphl.nist.gov,Department of Commerce,NIST,,API providing access to code sets managed by APHL used by (but not limited to) the healthcare IT vendor community
askchips.chips.gov,Department of Commerce,NIST,,Prodcution instance used to submit engagment requests
baldrigeresources.nist.gov,Department of Commerce,NIST,,"Blank page with nothing but title ""NIST Web Site"" and legal language (""You are accessing a U.S. Government information system …..."").  Baldrige offers a wide array of educational and assessment products/services to help organizations improve their performance."
bbddata.nist.gov,Department of Commerce,NIST,,"Site is a gateway to the contents of BBD webpage using the NISP patented NLP and search capabilities. Used by Researchers, Academic Institutions, and public citizens."
boudicca.nist.gov,Department of Commerce,NIST,,Computer Forensics Tools & Techniques Catalog
boulder.doc.gov,Department of Commerce,NIST,,Boulder's external site status page
calnet.nist.gov,Department of Commerce,NIST,,"Provides calibration services through readily available integrated circuit artifacts and a modern platform that offers customers real-time access to protocols, software, and data. "
cccbdb.nist.gov,Department of Commerce,NIST,,"The Computational Chemistry Comparison and Benchmark DataBase, SRD 101, provides a comprehensive collection of experimental and computational data for a selected set of gas-phase atoms and molecules"
cda-validation.nist.gov,Department of Commerce,NIST,,"Validation / conformance test tooling for health IT data, used by (but not limited to) the healthcare IT vendor community, ONC/ASTP certification, CDC, health IT system developers."
cdcs.registry.nist.gov,Department of Commerce,NIST,,"""Bad gateway"""
cfreds.nist.gov,Department of Commerce,NIST,,digitial foresnics data sets
cfreds-archive.nist.gov,Department of Commerce,NIST,,digital forensic reference data sets archived version; law enforcement investigators
chemdata.nist.gov,Department of Commerce,NIST,,Provides peptide mass spectral libraries.  These libraries are comprehnsive ref. collections designed to assist labs using mass spectrometry in proteomics research. 
circular.nist.gov,Department of Commerce,NIST,,"Tool for finding data and information resources related to enabling the US Circular Economy (CE). Used by scientists and Researchers, Academic Institutions, and public citizens."
code.nist.gov,Department of Commerce,NIST,,Research software - open source code catalog and metrics for USNISTGOV Github organization
concrete.nist.gov,Department of Commerce,NIST,,…to list of links on landing page.  This site provides links and redirection services for content that was relocated to comply with agency data management policy.
consensus.nist.gov,Department of Commerce,NIST,,Web application that performs different statistical methods for evaluating consensus estimates of interlaboratory studies. Intended audience is metrologists and scientists.
covid19-data.nist.gov,Department of Commerce,NIST,,puropse of the covid19 repository was to provide a curated version of a publically available covid19 research literature corpus for the purposes of analytics.
csrc.nist.gov,Department of Commerce,NIST,,collection of security resources and projects provided to the general public all in 1 centralized location
cstl.nist.gov,Department of Commerce,NIST,,A tool for processing automated particle analysis data sets
data.nist.gov,Department of Commerce,NIST,,"Research data public distribution service endpoint.   It requires for use additional parameters such as dataset id,  will not resolve in this base URL form"
decisiontree.nist.gov,Department of Commerce,NIST,,Web application that proposes and performs various statistical methods for evaluating concensus estimates of interlaboratory studies. Intended audience is metrologists and scientists.
dlmf.nist.gov,Department of Commerce,NIST,,defunct
duc.nist.gov,Department of Commerce,NIST,,DUC was an AI evaluation workshop for question answering and document summarization technology
e3.nist.gov,Department of Commerce,NIST,,"E3 is a REST API that provides life-cycle cost analysis, benefit-cost analysis, and risk-cost analysis used by NIST and other developers to implement end-user tools"
ecc.nist.gov,Department of Commerce,NIST,,This website is designed to assist the user in rapidly locating the relevant or desired metal-centered energy conversion complexes
edges.nist.gov,Department of Commerce,NIST,,The EDGe$ Tool supports community resilience planning by helping officials evaluate & compare the costs and benefits of investments to enhance recovery from disruptive events using standard methods.
emtoolbox.nist.gov,Department of Commerce,NIST,,"Offers computational tools for solving challenges in dimensional measurement. One tool calculates index of refraction of air, and other computes elastic compression of spheres and cylinders."
events.nist.gov,Department of Commerce,NIST,,Event registration portal for NIST-sponsored events
firedoc.nist.gov,Department of Commerce,NIST,,"FireDoc is NIST's online database of fire research. It offers reports/articles/papers on fire science, safety, and engineering for researchers, firefighters, and fire safety/prevention professionals."
fits.nist.gov,Department of Commerce,NIST,,"Validation / conformance test tooling for health IT data, used by (but not limited to) the healthcare IT vendor community, ONC/ASTP certification, CDC, health IT system developers."
gams.nist.gov,Department of Commerce,NIST,,mathematical and statistical software components for use in computational science and engineering;  
gashydrates.nist.gov,Department of Commerce,NIST,,The gashydrates.nist.gov site is very important to the TRC consortium and ACMD stakeholders.
ghgr.nist.gov,Department of Commerce,NIST,,"The Greenhouse Gas Data Registry (GHGR) facilitates the registration of greenhouse gas resources, connecting data resources with end-users"
hit-dev.nist.gov,Department of Commerce,NIST,,public server that supports SSD healthcare testing tools
hit-nexus.nist.gov,Department of Commerce,NIST,,"Nexus software repository manager where we host our software builds and dependencies (e.g. war and jar files), used by (but not limited to) the healthcare IT vendor community"
hl7v2-elr-testing.nist.gov,Department of Commerce,NIST,,"Validation / conformance test tooling for health IT data, used by (but not limited to) the healthcare IT vendor community, ONC/ASTP certification, CDC, health IT system developers."
hl7v2-gvt.nist.gov,Department of Commerce,NIST,,"Validation / conformance test tooling for health IT data, used by (but not limited to) the healthcare IT vendor community, ONC/ASTP certification, CDC, health IT system developers."
hl7v2-igamt.nist.gov,Department of Commerce,NIST,,"Validation / conformance test tooling for health IT data, used by (but not limited to) the healthcare IT vendor community, ONC/ASTP certification, CDC, health IT system developers."
hl7v2-igamt-2.nist.gov,Department of Commerce,NIST,,"Validation / conformance test tooling for health IT data, used by (but not limited to) the healthcare IT vendor community, ONC/ASTP certification, CDC, health IT system developers."
hl7v2-iz-cdc-testing.nist.gov,Department of Commerce,NIST,,"Validation / conformance test tooling for health IT data, used by (but not limited to) the healthcare IT vendor community, ONC/ASTP certification, CDC, health IT system developers."
hl7v2-iz-r1-5-testing.nist.gov,Department of Commerce,NIST,,"Validation / conformance test tooling for health IT data, used by (but not limited to) the healthcare IT vendor community, ONC/ASTP certification, CDC, health IT system developers."
hl7v2-lab-r2-testing.nist.gov,Department of Commerce,NIST,,"Validation / conformance test tooling for health IT data, used by (but not limited to) the healthcare IT vendor community, ONC/ASTP certification, CDC, health IT system developers."
hl7v2-lab-testing.nist.gov,Department of Commerce,NIST,,"Validation / conformance test tooling for health IT data, used by (but not limited to) the healthcare IT vendor community, ONC/ASTP certification, CDC, health IT system developers."
hl7v2-ss-r2-testing.nist.gov,Department of Commerce,NIST,,"Validation / conformance test tooling for health IT data, used by (but not limited to) the healthcare IT vendor community, ONC/ASTP certification, CDC, health IT system developers."
hl7v2tools.nist.gov,Department of Commerce,NIST,,Provides a menu of our validation / conformance testing tools with links to the tools along with descriptions and supporting information used by (but not limited to) the healthcare IT vendor community
ibal.nist.gov,Department of Commerce,NIST,,"The IBAL database supports research on intelligent building systems by providing high-frequency data from ~300 sensors and 850 points, with dashboards for plotting and downloading experiment data."
icsd.nist.gov,Department of Commerce,NIST,,NIST Inorganic Crystal Structure Database (ICSD) website is to give researchers a user-friendly interface to search a comprehensive collection of crystal structure data of inorganic compounds
ihe-pcd.nist.gov,Department of Commerce,NIST,,"Validation / conformance test tooling for health IT data, used by (but not limited to) the healthcare IT vendor community, ONC/ASTP certification, CDC, health IT system developers."
ihexds.nist.gov,Department of Commerce,NIST,,"Info concerning NIST-developed tooling (GitHub hosted) for health IT document sharing used by (but not limited to) the H-IT vendors, ONC/ASTP certification, IHE Connectathons, H-IT system developers."
ilthermo.boulder.nist.gov,Department of Commerce,NIST,,"ILThermo is a free, web-based database developed by NIST to provide comprehensive, up-to-date experimental data on ionic liquids"
ir.nist.gov,Department of Commerce,NIST,,"Blank page with nothing but title ""Warning Warning Warning"" and legal language (""You are accessing a U.S. Government information system …...""). Data annotation tools and large dataset access"
isg.nist.gov,Department of Commerce,NIST,,"""Under maintenance …check back later"".  The web pages provide interactive GoogleMaps-like access to very large collections of scientific images."
its90.nist.gov,Department of Commerce,NIST,,"The ITS-90 database provides info. on the Intl Temperature Scale of 1990 (ITS-90), including fixed temperature points, secondary reference temperature points, uncertainties, and references"
janaf.nist.gov,Department of Commerce,NIST,,"The NIST-JANAF Thermochemical Tables website contains thermochemical data for more than 1,700 chemical compounds"
jarvis.nist.gov,Department of Commerce,NIST,,"JARVIS is to automate the discovery and optimization of materials using classical force-field, density functional theory, machine learning, quantum computation calculations, and experiment"
kinetics.nist.gov,Department of Commerce,NIST,,The NIST Chemical Kinetics Database. You can explore reaction rate data for various chemical processes using this resource.
lre.nist.gov,Department of Commerce,NIST,,Unreachable
maldi.nist.gov,Department of Commerce,NIST,,The NDRL/NIST Solution Kinetics Database contains data on rate constants for solution-phase chemical reactions.
manufacturing.gov,Department of Commerce,NIST,,"Primary hub for federal manufacturing programs, funding opportunities, topic-focused pages & announcements relating to US manufacturing to help US manufacturers."
materials.registry.nist.gov,Department of Commerce,NIST,,"Used to register materials resources, connecting data resources with end-users.It serves as a central service to make registered information available for research to the materials science community."
math.nist.gov,Department of Commerce,NIST,,mathematical and statistical projects for use in computational science and engineering;  
mdcs.nist.gov,Department of Commerce,NIST,,purpose of the mdcs repository is to always provide a publicly available demo server providing the very latest release and features accessible to the public. 
meis.nist.gov,Department of Commerce,NIST,,"Manages Program & Center performance utilizing a centralized platform for data collection providing the MEP, stakeholders, and manufacturers benefit from insights & improved decision-making."
mfc.nist.gov,Department of Commerce,NIST,,Open Media Forensics Challenge is a media forensics evaluation to facilitate development of systems that can automatically detect and locate manipulations in imagery OpenMFC performers
mgi.gov,Department of Commerce,NIST,,"The Materials Genome Initiative is a federal multi-agency initiative for discovering, manufacturing, and deploying advanced materials. "
nccoe.nist.gov,Department of Commerce,NIST,,NCCOE website of projects
ncp.nist.gov,Department of Commerce,NIST,,collection of security checklists and benchmarks provided to the general public
nehrp.gov,Department of Commerce,NIST,,Provides information about the National Earthquake Hazards Reduction Program to stakeholders and the public
nehrpsearch.nist.gov,Department of Commerce,NIST,,"The NEHRP Clearinghouse is a NIST-managed database with earthquake engineering resources (research/codes/reports/standards) for structural engineers, architects, code officials, and researchers."
nemo.nist.gov,Department of Commerce,NIST,,"External-Used to manage the daily operations of the CNSTNanoFab, which includes tracking equipment usage, managing equipment reservations, and communicating minor and serious equipment problems.  "
nestr.nist.gov,Department of Commerce,NIST,,NEST-R (NIST Educational STEM Resource Registry) is a catalog of STEM educational resources from the National Institute of Standards and Technology (NIST)
nextg.nist.gov,Department of Commerce,NIST,,"The site for the NextG Channel Model Alliance, allows for sharing and curating large cellular datasets within the working group with a focus of 5G and mmWave."
