Website,Agency,Bureau,Office,Description
nigos.nist.gov,Department of Commerce,NIST,,Research and evaluation data is provided to biometrics community. Data requires agreement to terms and conditions of use.  Mission critical: Serves data files necessary for our evaluations.
nist.gov,Department of Commerce,NIST,,Main NIST Drupal site
nlte.nist.gov,Department of Commerce,NIST,,Provides NIST Non-Local Thermodynamic Equilibrium Plasma Kinetics Modeling Database. This database contains benchmark results for simulation of plasma population kinetics and emission spectra
nvd.nist.gov,Department of Commerce,NIST,,collection of vulnerability data provided to the general public and vulnerability management vendors 
nvlpubs.nist.gov,Department of Commerce,NIST,,"…to various links off landing page. Hosts versions of record of NIST/NBS publications. All Digital Object Identifiers (DOIs) point to these versions. Audience is scientific researchers, cybersecurity experts, and lay-people."
openfad.nist.gov,Department of Commerce,NIST,,evaluation to measure how well systems can automatically classify or temporally detect fine-grained activities collected from Consented Activities of People using handheld devices. openfad performers
p-act.nist.gov,Department of Commerce,NIST,,Tool for comparing HL7 v2 profiles which a provides dynamic summary report of the comparison analysis used by (but not limited to) the healthcare IT vendor community
pages.nist.gov,Department of Commerce,NIST,,This service provides web publishing of static content hosted in a specific branch of a NIST GitHub repository. Pages automatically and immediately update when a commit is pushed to that branch.
pah.nist.gov,Department of Commerce,NIST,,"The NIST PAH database allows you to search for Polycyclic Aromatic Hydrocarbons (PAHs) and obtain information regarding their identifiers, links, estimated properties, and thermochemistry"
phasedata.nist.gov,Department of Commerce,NIST,,"Currently resolving a ""Bad gateway"" error at the host.  The NIST Materials Data Curation System provides access to phase-based data essential for various applications, including the development of CALPHAD-based multicomponent databases."
potentials.nist.gov,Department of Commerce,NIST,,"Currently resolving a ""Bad gateway"" error at the host.  The Interatomic Potentials Repository API is a system developed at NIST for curating Material Data in a repository using predefined templates"
pv2.nist.gov,Department of Commerce,NIST,,[PV]² allows homeowners to determine a complete cost of ownership for residential rooftop solar photovoltaic systems including purchase and operation through the system’s service life.
pvdata.nist.gov,Department of Commerce,NIST,,"Pvdata offers public access to NIST photovoltaic and weather data, with one-minute averages (2015-2018), sky/array images hourly, and interactive tools for exploration and bulk download."
randr.nist.gov,Department of Commerce,NIST,,"Enzyme Thermodynamic Database a specialized scientific resource maintained by the NIST. Its primary purposes are: Storing Thermodynamic Data, Chemical Equilibrium Analysis, and Research Support"
randr19.nist.gov,Department of Commerce,NIST,,"provides access to COVID-19 resources and tools, including frequency graphs, co-phrase graphs, and term trends related to the CORD-19 dataset."
rdaf.nist.gov,Department of Commerce,NIST,,"The NIST Research Data Framework (RDaF) is a comprehensive, customizable tool designed to help organizations and individuals manage research data effectively"
reductus.nist.gov,Department of Commerce,NIST,,NCNR data reduction online site
rpki-monitor.antd.nist.gov,Department of Commerce,NIST,,The NIST RPKI monitor is a test and measurement tool designed to monitor the dynamics of the global RPKI and the impact of RPKI-ROV on Internet routing.
rtmms.nist.gov,Department of Commerce,NIST,,"Tool to enable management of standardized medical device terminology to improve interoperability between devices and systems, used by (but not limited to) the healthcare IT vendor community"
sat.nist.gov,Department of Commerce,NIST,,"Brings together researchers to address speech analytic challenges in difficult acoustic conditions for improving through objective, large-scale common evaluations."
shop.nist.gov,Department of Commerce,NIST,,"The NIST Store is an online shopping experience where customers can order NIST products and services including calibration services, Standard Reference Data products, and Standard Reference Materials."
sibr.nist.gov,Department of Commerce,NIST,,SIBR database provides information on standards that have been incorporated by reference into the US Code of Federal Regulations (CFR)
sitexpress.nist.gov,Department of Commerce,NIST,,"Calculates metrics for investment analysis documented in NIST Advanced manufacturing Series 200-5. It calculates net present value, internal rate of return, and payback period."
smstestbed.nist.gov,Department of Commerce,NIST,,Provides real-time data from the equipment in the Smart Manufacturing Systems Test Bed
srdata.nist.gov,Department of Commerce,NIST,,The NIST Standard Reference Data website gives you access to a variety of scientific and technical data
sre.nist.gov,Department of Commerce,NIST,,NIST Speaker Recognition Evaluation series is to contribute to the direction of research efforts and the calibration of technical capabilities of text independent speaker recognition. SRE performers
strbase.nist.gov,Department of Commerce,NIST,,"STRBase is a specialized database for forensic DNA analysis, focusing on Short Tandem Repeat (STR) markers. "
survey.nist.gov,Department of Commerce,NIST,,Allows the public to respond to NIST surveys.
tac.nist.gov,Department of Commerce,NIST,,"TAC is the successor to DUC and is an AI evaluation workshop focused on NLP, information extraction, summarization, QA."
tcamt.nist.gov,Department of Commerce,NIST,,"Validation / conformance test tooling for health IT data, used by (but not limited to) the healthcare IT vendor community, ONC/ASTP certification, CDC, health IT system developers."
time.gov,Department of Commerce,NIST,,US Official Time
toolcatalog.nist.gov,Department of Commerce,NIST,,searchable catalog of forensic tools and techniques
trc.nist.gov,Department of Commerce,NIST,,NIST Combustion Calorimetry Tool standardizes the complex process of determining enthalpies of formation for organic compounds. 
trec.nist.gov,Department of Commerce,NIST,,"TREC is an AI evaluation workshop focused on search, filtering, generation, and other technologies for information understanding."
trecvid.nist.gov,Department of Commerce,NIST,,"Proceedings and data for the TRECVID evaluations of multimedia search, 2001-present. TRECVID is an evaluation workshop for video search and understanding"
tsapps.nist.gov,Department of Commerce,NIST,,A compendium of publicly available biometric datasets
uncertainty.nist.gov,Department of Commerce,NIST,,Software application that carries out uncertainty propogation as outlined in the Guide to Uncertainty of Measurement. Intended audience is metrologists and scientists.
usgv6-deploymon.nist.gov,Department of Commerce,NIST,,NIST developed the USGv6 monitor to estimate answers to measurement questions about the extent and quality of IPv6 and DNSSEC deployment in the USG and Internet as a whole.
visiblecement.nist.gov,Department of Commerce,NIST,,"algorithms for processing visible cement datasets, audience- building infrastructure community"
vmsshare.nist.gov,Department of Commerce,NIST,,"This is a mass spectrometry data mining and repository website. The purpose of it is to effectively visualize raw MS data, display corresponding metadata and share experimental results."
vocab.nist.gov,Department of Commerce,NIST,,FHIR adapter API providing access to CDC's PHIN VADS vocabulary system used by (but not limited to) the healthcare IT vendor community
webbook.nist.gov,Department of Commerce,NIST,,"The NIST Chemistry WebBook offers a vast collection of chemical and physical property data for over 7,000 organic and small inorganic compounds."
wipp-plugins.nist.gov,Department of Commerce,NIST,,The web pages are designed to disseminate metadata about interoperable scientific software packaged in Docker containers.
ws680.nist.gov,Department of Commerce,NIST,,"Building for Environmental and Economic Sustainability is a tool to select cost-effective, environmentally-preferable building products"
wtt-lite.nist.gov,Department of Commerce,NIST,,This web application provides access to a collection of critically evaluated thermodynamic property data for pure compounds with a primary focus on organics
wtt-pro.nist.gov,Department of Commerce,NIST,,This web application provides access to a collection of critically evaluated thermodynamic property data for pure compounds with a primary focus on organics
www-nlpir.nist.gov,Department of Commerce,NIST,,"This site hosts a number of pages linked from the DUC, TAC, and TRECVID websites, and we have kept the URL to avoid broken links."
zeno.nist.gov,Department of Commerce,NIST,,"The ZENO software tool computes material, solution, and suspension properties for a specified particle shape or molecular structure using path-integral and Monte Carlo methods."
adios.orr.noaa.gov,Department of Commerce,NOAA,,"A database tool of 1,000+ petroleum products and their characteristics, used to support oil spill response. The data can be downloaded for use with NOAA’s or other oil spill weathering models."
adp.noaa.gov,Department of Commerce,NOAA,,"Mandated by the America COMPETES Reauthorization Act, this site provides access to “educational activities related to understanding ocean sciences” for communication and engagement with classrooms. "
airquality.weather.gov,Department of Commerce,NOAA,,"Provides computer-generated, hourly forecasts for various air quality variables to inform health-related decisions by the public."
alaskafisheries.noaa.gov,Department of Commerce,NOAA,,"Used for commercial fishing transactions, permitting, fee payments, transfers, monitoring, reporting, and data dissemination in support of the Alaska Region's fisheries management programs.  "
alerts.weather.gov,Department of Commerce,NOAA,,A GUI interface that assits users in generating NWS alerts as distributed by the NWS API (api.weather.gov)
alerts-v2.weather.gov,Department of Commerce,NOAA,,
alpha.ngs.noaa.gov,Department of Commerce,NOAA,,"Provides public access to precise geodetic data for mapping, surveying, and infrastructure for the modernized National Spatial Reference System that will save costs for agency and industry."
amdar.ncep.noaa.gov,Department of Commerce,NOAA,,
amdar.noaa.gov,Department of Commerce,NOAA,,"Resolves with ""Bad Request"".  America COMPETES Act SEC 4002(a) and other mandates specify that NOAA “shall enhance public awareness and understanding of ocean and atmospheric science.” OAR websites are the primary tool for this."
americansamoa.noaa.gov,Department of Commerce,NOAA,,"Mandated by the National Marine Sanctuaries Act to enhance public awareness, understanding and appreciation of the marine environment, this site provides vital information for the tax paying public."
aocground.omao.noaa.gov,Department of Commerce,NOAA,,Provides means for land-based personel to submit TAG and TDR data to NWS removing the burden from scientists on the aircraft during the flight
aoml.noaa.gov,Department of Commerce,NOAA,,America COMPETES Act SEC 4002(a) and other mandates specify that NOAA “shall enhance public awareness and understanding of ocean and atmospheric science.” OAR websites are the primary tool for this. 
app.coastalscience.noaa.gov,Department of Commerce,NOAA,,These data archives provide trend data for making recreational and fisheries management decisions as they relate to seafood safety and security – supplemental data to NCCOS operational models
apps.arl.noaa.gov,Department of Commerce,NOAA,,"Provides HYSPLIT-based applications and analysis for volcano ash, wild fire, Urban Net, locust migration, etc. used by public health and other organizations.
"
apps.nmfs.noaa.gov,Department of Commerce,NOAA,,"The APPS system allows the public to submit, track, and query permit applications and reports online for permits and authorizations required under the ESA and MMPA. It is used by NMFS and ODFW."
apps.nssl.noaa.gov,Department of Commerce,NOAA,,Hosts a number of one-off science applications for lab and research partner use. These individual applications are key to the lab’s efforts in most all major projects.
apps-afsc.fisheries.noaa.gov,Department of Commerce,NOAA,,The primary purpose is to support transactional applications required under regulations for the North Pacific Observer Program
apps-garfo.fisheries.noaa.gov,Department of Commerce,NOAA,,Hosts multiple apps that support regulatory compliance and transactions and required data access and analysis.
apps-pifsc.fisheries.noaa.gov,Department of Commerce,NOAA,,"Provides public access to nonconfidential commercial fisheries data and visualizations for the Pacific Islands Region, supporting management, research, and stakeholder engagement."
apps-sefsc.fisheries.noaa.gov,Department of Commerce,NOAA,,"Hosts tools that support the collection, management, and sharing of fisheries-dependent data across the Southeast Region."
archive.fisheries.noaa.gov,Department of Commerce,NOAA,,Fisheries archive
archive.oceanexplorer.noaa.gov,Department of Commerce,NOAA,,Archived version of oceanexplorer.noaa.gov; fulfills records management requirements and allows users continued access older content following migration of active office site to WordPress
arctic.noaa.gov,Department of Commerce,NOAA,,"Supports Section 508 and Open Gov mandates, advancing transparency, accessibility, and public engagement. Mandated by America Competes Reauthorization 42 U.S.C. § 6681"
arl.noaa.gov,Department of Commerce,NOAA,,"Introducing ARL's major research areas, news, publications, and HYSPLIT information to the public, researchers, and responders, etc."
atlhmscatchshares.fisheries.noaa.gov,Department of Commerce,NOAA,,"Mandated for Atlantic HMS Bluefin Tuna quota compliance, this system allows users to manage individualized allocations, landings, and reports, with integrated permit, VMS, and monitoring capabilities."
aviationweather.gov,Department of Commerce,NOAA,,Provides critical aviation weather information generated by the Aviation Weather Center and regional Center Weather Service Units both visually and via an API.
beaconregistration.noaa.gov,Department of Commerce,NOAA,,"Real-time emergency distress register. Allows the public to register 406 MHz emergency distress beacons (ships, planes, persons) as required by law. More efficient than mail or phone registration."
beta.ngs.noaa.gov,Department of Commerce,NOAA,,Enhances National Spatial Reference System development providing geodetic tools & data for positioning.  Ensures accuracy and cost effective solutions for nation's mapping and infrastructure needs.  
beta.weather.gov,Department of Commerce,NOAA,,Where the beta version of a new weather.gov is being iteratively developed and public feedback collected.
bigsouthfork.atdd.noaa.gov,Department of Commerce,NOAA,,"Hyperlocal met data (Big South Fork Sonic Wind Anemometer Data) for the public, researchers, and forecasters
"
blog.marinedebris.noaa.gov,Department of Commerce,NOAA,,A web-based tool supporting NOAA’s disaster and pollution preparedness and response work. Provides updates on and reporting for Marine Debris Program activities and projects.
blog.response.restoration.noaa.gov,Department of Commerce,NOAA,,A web-based tool supporting NOAA’s disaster and pollution preparedness and response work. Provides updates on and reporting for OR&R's mission activities to address a range of hazards.
boulder.noaa.gov,Department of Commerce,NOAA,,"Mandated by the America COMPETES Act, this site provides efficient, non-duplicative access to all NOAA Boulder Line Offices, reducing redundancy while advancing STEM, innovation, and public research"
buoybay.noaa.gov,Department of Commerce,NOAA,,"Chesapeake Bay real-time meteorological, oceanographic, and water-quality data. Data are used by scientists, meteorologists, boaters, fishermen, and more. "
bycatchreporting.fisheries.noaa.gov,Department of Commerce,NOAA,,"NMFS implements congressionally mandated programs for protected species and bycatch in international fisheries, administered through the International Affairs Information Capture and Reporting System."
cafe.orr.noaa.gov,Department of Commerce,NOAA,,"A database supporting NOAA’s disaster and pollution preparedness and response staff and user community. Provides data on the fate and effects of chemicals, oils, and dispersants in aquatic ecosystems."
california-mdc.diver.orr.noaa.gov,Department of Commerce,NOAA,,A web-based tool supporting NOAA’s disaster and pollution preparedness and response staff and user community. Provides a collaboration space for marine debris stakeholders in California.
cameo.noaa.gov,Department of Commerce,NOAA,,Describes a suite of hazardous materials response and planning tools that work interactively to help first responders and emergency planners get critical information quickly and easily.
cameochemicals.noaa.gov,Department of Commerce,NOAA,,"A database of thousands of hazardous chemical datasheets that emergency responders and planners use to get critical response information and predict hazards, such as explosions or toxic fumes."
campcreek.atdd.noaa.gov,Department of Commerce,NOAA,,"Hyperlocal met data (Camp Creek Prop Wind Monitor Data) for the public and researchers, and forecasters"
cams.nssl.noaa.gov,Department of Commerce,NOAA,,Displays state-of-the-art experimental severe weather forecast data in real-time for critical decision support. Enables accountability & public feedback. 
carbontracker.noaa.gov,Department of Commerce,NOAA,,"In support of U.S. statutory requirements, GML's website provides data and information on physical quantities, such as greenhouse gases, ozone, radiation, and aerosols, influencing the Earth system."
carto.bldc.nwave.noaa.gov,Department of Commerce,NOAA,,"WorldView is an interactive, real-time network visualization system providing a map-based view of NOAA NWave and XWave network connectivity."
carto.ctc.nwave.noaa.gov,Department of Commerce,NOAA,,"WorldView is an interactive, real-time network visualization system providing a map-based view of NOAA NWave and XWave network connectivity."
carto.nwave.noaa.gov,Department of Commerce,NOAA,,"WorldView is an interactive, real-time network visualization system providing a map-based view of NOAA NWave and XWave network connectivity."
cbexapp.noaa.gov,Department of Commerce,NOAA,,"Interactive Chesapeake Bay education courses about science and data; information about upcoming workshops and resources, for K-12 educators. "
cbrfc.noaa.gov,Department of Commerce,NOAA,,"Home page for the Colorado Basin River Forecast Center, serving river forecast information. "
cbwofs.nssl.noaa.gov,Department of Commerce,NOAA,,"Tool that allows NWS forecasters to schedule and receive dynamically updating, real-time Warn-on-Forecast System predictions that make weather warnings earlier and more precise."
cdhc.noaa.gov,Department of Commerce,NOAA,,"A network of coral health professionals provide efficient access to scientific information, educational materials, and tools to help coastal managers protect and restore healthy coral reef ecosystems"
celebrating200years.noaa.gov,Department of Commerce,NOAA,,"Developed in 2007 for NOAA's 200th celebration, this website highlighted NOAA's rich history of science, service, and stewardship provided to the American public. Site is no longer updated."
certificate.seafoodinspection.nmfs.noaa.gov,Department of Commerce,NOAA,,The Seafood Inspection Program's Verification system provides for online verifications of completed certificates issued by the Seafood Inspection Program.
cfs.ncep.noaa.gov,Department of Commerce,NOAA,,"Home for Climate Forecast System (CFS), which is managed by the National Centers for Environmental Prediction. Provides climate prediction data and model output for both researchers and forecasters."
channelislands.noaa.gov,Department of Commerce,NOAA,,"Mandated by the National Marine Sanctuaries Act to enhance public awareness, understanding and appreciation of the marine environment, this site provides vital information for the tax paying public."
charts.noaa.gov,Department of Commerce,NOAA,,"Provides chart download files in a cloud-based, machine readable format for navigation systems used by the entire maritime community (commercial mariners, USCG/Navy/USACE, boaters) to display charts"
ci.noaa.gov,Department of Commerce,NOAA,,America COMPETES Act SEC 4002(a) and other mandates specify that NOAA “shall enhance public awareness and understanding of ocean and atmospheric science.” OAR websites are the primary tool for this.
class.noaa.gov,Department of Commerce,NOAA,,Historical satellite datasets applicable to all US economic sectors for public and government partners to use without fees.
clearinghouse.marinedebris.noaa.gov,Department of Commerce,NOAA,,"A web-based tool supporting NOAA’s disaster and pollution preparedness and response staff and user community. A federal marine debris information clearinghouse, as mandated by the Marine Debris Act."
climate.gov,Department of Commerce,NOAA,,"Climate.gov offers science data, information, and tools to support adaptation, mitigation, and informed decision-making for the public and private sectors."
cmist.noaa.gov,Department of Commerce,NOAA,,C-MIST is designed to process and visualize NOAA's current meter data. It also serves as a public data access portal for current meter data and allows for users to generate custom analyses and plots. 
coast.noaa.gov,Department of Commerce,NOAA,,"Delivers authoritative economic and geospatial data and visualization/decision tools from 900+ organizations to communities, programs, and private sector, as required by the Digital Coast Act."
coastaloceanmodels.noaa.gov,Department of Commerce,NOAA,,"Provides storm surge models and operational forecasts via data and apps to National Weather Service and other coastal/maritime safety agencies, enabling accurate forecasting in U.S. coastal regions"
coastalscience.noaa.gov,Department of Commerce,NOAA,,"Premier source for NOAA’s coastal ocean data, communicates information & HAB and pathogen forecasts that coastal managers need to make decisions to protect community, economic & ecosystem health"
coastwatch.glerl.noaa.gov,Department of Commerce,NOAA,,"Provides critical Great Lakes observations on ice cover, lake temperatures, and algae to inform marine transportation, HAB forecasts, search and rescue operations, weather forecasts, etc."
coastwatch.noaa.gov,Department of Commerce,NOAA,,"Provide satellite ocean data to government and non-government partners, inlcuding in the commerical sector. "
coastwatch.pfeg.noaa.gov,Department of Commerce,NOAA,,"Provides access, tools, and training to use NOAA ocean satellite data, including ecosystem indicators, habitat models for endangered species, and harmful algal bloom forecasts."
codes.nws.noaa.gov,Department of Commerce,NOAA,,"One purpose of this Service is to support the new data exchange standard developed by WMO in support of Amendment 76 to ICAO Annex 3 ""Meteorological Services for International Air Navigation"". "
coralreef.noaa.gov,Department of Commerce,NOAA,,"Distributes, on a public website, the data sets, documents and reports of the Coral Program as required by the Coral Reef Conservation Act of 2000 16 U.S.C. § 6402, § 6403, and § 6404"
coralreefwatch.noaa.gov,Department of Commerce,NOAA,,"Provides access to the global early-warning system for coral reef health, which is necessary for understanding essential fisheries and tourism and protecting coasts from erosion and tropical storms."
cordellbank.noaa.gov,Department of Commerce,NOAA,,"Mandated by the National Marine Sanctuaries Act to enhance public awareness, understanding and appreciation of the marine environment, this site provides vital information for the tax paying public."
coris.noaa.gov,Department of Commerce,NOAA,,"Timed out multiple time.  Distributes, on a public website, the data sets, documents and reports of the Coral Program as required by the Coral Reef Conservation Act of 2000 16 U.S.C. § 6402, § 6403, and § 6404"
councils.fisheries.noaa.gov,Department of Commerce,NOAA,,"Supports Regional Fishery Managment Council appointments, which are mandated by law, by enabling online material completion and submission and agency review and coordination of the process."
cpc.ncep.noaa.gov,Department of Commerce,NOAA,,Homepage of the NWS Climate Prediction Center for provision of their forecast products. More in Q11
cpo.noaa.gov,Department of Commerce,NOAA,,"The CPO website shares info about our annual competitive grants, and our work in climate science & services research & development; for peer communities & the public."
csl.noaa.gov,Department of Commerce,NOAA,,Non-duplicative public information on (i) federally funded activities mandated by the Weather Act & Congress. appropriations and (ii) public access to NOAA atmospheric composition data (NAO 212-15B).
cwcaribbean.aoml.noaa.gov,Department of Commerce,NOAA,,"Gateway to the NOAA CoastWatch Caribbean and Gulf of America Regional Node, providing near real-time satellite oceanographic data for researchers across the nation."
cwcgom.aoml.noaa.gov,Department of Commerce,NOAA,,NOAA AOML Atlantic OceanWatch portal offering satellite data products and visualization tools to support research and operations.
